Citation,Citation URL,Title,Number of Consequences,Relevant Subsections,Related Statutes,Notes,Current Through,Jurisdiction,Consequences,Keywords,Offense Type,Discretion,Duration
"23 V.S.A. § 2502","","Points on driver's license ","1","All","","","2023 legislative session and all 2023 regulatory rulemaking","","Motor vehicle licensure (non-commercial)","Driving & noncommercial motor vehicles","Motor vehicle offenses","Mandatory/Automatic","Time-limited"
"13 V.S.A. § 7606","https://plus.lexis.com/search/?pdmfid=1530671&crid=3d5a540a-c6c0-4070-a32e-450793fa68a9&pdsearchterms=13+V.S.A.+%C2%A7+7606&pdtypeofsearch=searchboxclick&pdsearchtype=SearchBox&pdstartin=&pdpsf=&pdqttype=and&pdquerytemplateid=&ecomp=1g_ck&earg=pdsf&prid=6fb02324-62cd-4ddb-af8f-73140f38660a","Effect of Expungement ","1","(a),(b)","","","2023 legislative session and all 2023 regulatory rulemaking legislative session ","","General Relief Provision","Expungement, sealing & criminal record access restrictions","N/A (background check, general relief)","N/A - General Relief","N/A (background check, general relief)"
"7 V.S.A. § 954","https://plus.lexis.com/search/?pdmfid=1530671&crid=95f548fe-3e27-45f1-bc67-e10e63c30913&pdsearchterms=7+V.S.A.+%C2%A7+954&pdtypeofsearch=searchboxclick&pdsearchtype=SearchBox&pdstartin=&pdpsf=&pdqttype=and&pdquerytemplateid=&ecomp=1g_ck&earg=pdsf&prid=2350685d-b88b-41fd-8868-572f51f4b03c","Medical Cannabis Registry Caregiver ","1","(b),(c)","","","2023 legislative session and all 2023 regulatory rulemaking legislative session ","","Occupational & professional licensure & certification","Health care","N/A (background check, general relief)","Background Check","N/A (background check, general relief)"
"10A V.S.A. § 12","http://legislature.vermont.gov/statutes/section/10APPENDIX/001/00012","Ineligible for leashed tracking dog license","1","(5)(b)","","","2023 legislative session and all 2023 regulatory rulemaking","","Recreational license & participation, including firearms|Occupational & professional licensure & certification","Wildlife, fish & game","Recreational license offenses","Mandatory/Automatic","Time-limited"
"11C V.S.A. § 902","http://legislature.vermont.gov/statutes/section/11C/009/00902","Deny indemnification of director by mutual benefit enterprise","1","(a) - (c)","","","2023 legislative session and all 2023 regulatory rulemaking","","Judicial Rights|Civil fines, liability, forfeiture & property rights","","Any felony|Any misdemeanor","Discretionary","Indefinite"
"12 V.S.A. § 1608","http://legislature.vermont.gov/statutes/section/12/061/01608","Impeach credibility of witness in court","1","All","","","2023 legislative session and all 2023 regulatory rulemaking","","Judicial Rights","Judicial evidence & witnesses","Crimes involving fraud, dishonesty, misrepresentation or money-laundering|Crime of moral turpitude","Discretionary","Time-limited"
"13 V.S.A. § 1383","http://legislature.vermont.gov/statutes/section/13/028/01383","Register on the adult abuse registry","1","All","","","2023 legislative session and all 2023 regulatory rulemaking","","Registration, publication & notification","Adult care, nursing homes & residential care facilities","Crimes of violence, including 'person offenses'|Sex offenses","Mandatory/Automatic","Indefinite"
"13 V.S.A. § 2029","http://law.justia.com/codes/vermont/2012/title13/chapter47/section2029/","Limit ability to engage in home improvement activities for compensation","1","(f)","","","2023 legislative session and all 2023 regulatory rulemaking","","Employment & volunteering|Business licensure & participation","Construction, improvement & repair, engineering, plumbing, HVAC, surveying, design & architecture","Crimes involving fraud, dishonesty, misrepresentation or money-laundering","Mandatory/Automatic","Indefinite"
"13 V.S.A. § 2658","http://legislature.vermont.gov/statutes/section/13/060/02658","Vacate/expunge prostitution conviction of human trafficking victim","0","All","","","2023 legislative session and all 2023 regulatory rulemaking","","General Relief Provision","Dismissal, set-aside, vacatur & offense reduction|Expungement, sealing & criminal record access restrictions","N/A (background check, general relief)","N/A - General Relief","N/A (background check, general relief)"
"13 V.S.A. § 5410","http://legislature.vermont.gov/statutes/section/13/167/05410","Notify victim of sex offender registration/change of address","1","All","","","2023 legislative session and all 2023 regulatory rulemaking","","Registration, publication & notification","Sex offender registration, residency & proximity","Crimes of violence, including 'person offenses'|Sex offenses","Discretionary","Indefinite"
"13 V.S.A. § 5411a","http://legislature.vermont.gov/statutes/section/13/167/05411a","Register on electronic sex offender registry","1","All","","","2023 legislative session and all 2023 regulatory rulemaking","","Registration, publication & notification","Sex offender registration, residency & proximity","Crimes of violence, including 'person offenses'|Sex offenses","Mandatory/Automatic","Indefinite"
"13 V.S.A. § 5411c","http://legislature.vermont.gov/statutes/section/13/167/05411c","Notify public of sex offender required to be posted on internet","1","All","","","2023 legislative session and all 2023 regulatory rulemaking","","Registration, publication & notification","Sex offender registration, residency & proximity","Crimes of violence, including 'person offenses'|Sex offenses","Discretionary","Indefinite"
"13 V.S.A. § 5422","http://legislature.vermont.gov/statutes/section/13/167/05422","Civil liability to crime victim for profits of crime","1","(a)","","","2023 legislative session and all 2023 regulatory rulemaking legislative session ","","Civil fines, liability, forfeiture & property rights","Civil litigation & administrative proceedings","Any felony|Any misdemeanor","Discretionary","Indefinite"
"14 V.S.A. § 322","http://legislature.vermont.gov/statutes/section/14/042/00322","Forfeit share in decedent's estate","1","All","","","2023 legislative session and all 2023 regulatory rulemaking","","Judicial Rights|Civil fines, liability, forfeiture & property rights","Trusts, estates & guardianship","Crimes of violence, including 'person offenses'","Mandatory/Automatic","Indefinite"
"15 V.S.A. § 1115","http://legislature.vermont.gov/statutes/section/15/021/01115","Deny visitation with child","1","All","","","2023 legislative session and all 2023 regulatory rulemaking","","Family & domestic rights","Child custody, visitation & parental rights","Crimes of violence, including 'person offenses'|Sex offenses","Discretionary","Indefinite"
"15 V.S.A. § 817","http://legislature.vermont.gov/statutes/section/15/013/00817","Ineligible for name change (registered sex offender)","1","All","","","2023 legislative session and all 2023 regulatory rulemaking","","Judicial Rights","Sex offender registration, residency & proximity","Crimes of violence, including 'person offenses'|Sex offenses","Discretionary (waiver)","Indefinite"
"15A V.S.A. § 1-113","http://legislature.vermont.gov/statutes/section/15A/001/00113","Background check for prospective adoptive parent","1","All","","","2023 legislative session and all 2023 regulatory rulemaking","","Family & domestic rights","Child custody, visitation & parental rights|Adoption & foster care","N/A (background check, general relief)","Background Check","N/A (background check, general relief)"
"18 V.S.A. § 4208","http://legislature.vermont.gov/statutes/section/18/084/04208","Ineligible for regulated drugs license/certificate (conviction of applicant/managing officer)","1","(1),(4)","","","2023 legislative session and all 2023 regulatory rulemaking legislative session ","","Occupational & professional licensure & certification","Health care|Pharmacy & drugs","Controlled substances offenses","Mandatory/Automatic","Indefinite"
"21 V.S.A. § 1344","http://legislature.vermont.gov/statutes/section/21/017/01344","Ineligible for unemployment compensation benefits","1","(a)(1)(B)","","","2023 legislative session and all 2023 regulatory rulemaking","","Government benefits","Social Security, SSI, unemployment & disability benefits","Any felony|Any misdemeanor","Mandatory/Automatic","Time-limited"
"23 V.S.A. § 1201","http://legislature.vermont.gov/statutes/section/23/013/01201","Ineligible to operate a motor vehicle with an alcohol concentration at 0.02 or more","1","(a)-(f)","","","2023 legislative session and all 2023 regulatory rulemaking legislative session ","","Motor vehicle licensure (non-commercial)","Driving & noncommercial motor vehicles","Controlled substances offenses|Motor vehicle offenses","Mandatory/Automatic","Time-limited"
"23 V.S.A. § 1208","http://legislature.vermont.gov/statutes/section/23/013/01208","Revoke driver license/operating privilege (third DUI conviction)","2","(b)","Relief:
23 V.S.A. § 1209a 
23 V.S.A. § 1213","","2023 legislative session and all 2023 regulatory rulemaking","","Motor vehicle licensure (non-commercial)","Driving & noncommercial motor vehicles","Controlled substances offenses|Motor vehicle offenses","Mandatory/Automatic","Varies"
"23 V.S.A. § 1216","http://legislature.vermont.gov/statutes/section/23/013/01216","Suspend driver license/operating privilege (DUI conviction for person under 21 years of age)","1","All","See also: 
23 V.S.A. § 1209a","","2023 legislative session and all 2023 regulatory rulemaking","","Motor vehicle licensure (non-commercial)","Driving & noncommercial motor vehicles","Controlled substances offenses|Motor vehicle offenses","Mandatory/Automatic","Conditional"
"23 V.S.A. § 1709","http://legislature.vermont.gov/statutes/section/23/017/01709","Notify commissioner of motor vehicles of conviction","1","All","","","2023 legislative session and all 2023 regulatory rulemaking","","Motor vehicle licensure (non-commercial)|Registration, publication & notification","Driving & noncommercial motor vehicles","Motor vehicle offenses","Mandatory/Automatic","Indefinite"
"23 V.S.A. § 2086","http://legislature.vermont.gov/statutes/section/23/021/02086","Impeach credibility of defendant","1","All","","","2023 legislative session and all 2023 regulatory rulemaking","","Judicial Rights","Judicial evidence & witnesses","Motor vehicle offenses|Crimes involving fraud, dishonesty, misrepresentation or money-laundering","Discretionary","Indefinite"
"23 V.S.A. § 3207a","http://legislature.vermont.gov/statutes/section/23/029/03207a","Suspend privilege to operate a snowmobile (DUI)","1","(a), (h)","","","2023 legislative session and all 2023 regulatory rulemaking","","Recreational license & participation, including firearms","Recreational vehicles","Controlled substances offenses|Recreational license offenses","Mandatory/Automatic","Conditional"
"23 V.S.A. § 3317","http://legislature.vermont.gov/statutes/section/23/029/03317","Suspend privilege to operate a motorboat (DUI)","1","(d), (h)","","","2023 legislative session and all 2023 regulatory rulemaking","","Recreational license & participation, including firearms","Recreational vehicles","Controlled substances offenses|Recreational license offenses","Mandatory/Automatic","Time-limited"
"23 V.S.A. § 4113","http://legislature.vermont.gov/statutes/section/23/039/04113","Notify licensing state of out-of-state conviction of commercial driver","1","All","","","2023 legislative session and all 2023 regulatory rulemaking","","Registration, publication & notification|Occupational & professional licensure & certification","Transportation & commercial motor vehicles","Motor vehicle offenses","Mandatory/Automatic","Indefinite"
"23 V.S.A. § 4116a","http://legislature.vermont.gov/statutes/section/23/039/04116a","Suspend privilege to operate commercial motor vehicle (1 year for first DUI conviction)","4","All","","","2023 legislative session and all 2023 regulatory rulemaking","","Occupational & professional licensure & certification","Transportation & commercial motor vehicles","Controlled substances offenses|Motor vehicle offenses","Mandatory/Automatic","Varies"
"23 V.S.A. § 603","http://legislature.vermont.gov/statutes/section/23/009/00603","Deny motor vehicle license (out of state license holders)","1","(a)(2)","","","2023 legislative session and all 2023 regulatory rulemaking legislative session ","","Motor vehicle licensure (non-commercial)","Driving & noncommercial motor vehicles","Any felony|Any misdemeanor","Discretionary","Indefinite"
"23 V.S.A. § 607a","http://legislature.vermont.gov/statutes/section/23/009/00607a","Revoke learner's permit/junior operator's license","1","(a), (b)","","","2023 legislative session and all 2023 regulatory rulemaking","","Motor vehicle licensure (non-commercial)","Driving & noncommercial motor vehicles","Any felony|Any misdemeanor","Discretionary","Indefinite"
"23 V.S.A. § 617","http://legislature.vermont.gov/statutes/section/23/009/00617","Ineligible for motor vehicle learner's permit","1","(a)","","","2023 legislative session and all 2023 regulatory rulemaking","","Motor vehicle licensure (non-commercial)","Driving & noncommercial motor vehicles","Controlled substances offenses|Motor vehicle offenses","Mandatory/Automatic","Time-limited"
"24A V.S.A. § 101-44","http://legislature.vermont.gov/statutes/section/24APPENDIX/101/00044","Remove from office in town of Barre","1","(3)","","","2023 legislative session and all 2023 regulatory rulemaking","","Political & civic participation|Employment & volunteering","Public office","Any felony","Mandatory/Automatic","Indefinite"
"24A V.S.A. § 157-41","http://legislature.vermont.gov/statutes/chapter/24APPENDIX/157","Remove from office in town of Windsor","1","(b)","","","2023 legislative session and all 2023 regulatory rulemaking","","Political & civic participation|Employment & volunteering","Public office","Any felony","Mandatory/Automatic","Indefinite"
"26 V.S.A. § 1395","http://legislature.vermont.gov/statutes/section/26/023/01395","Background check for license to provide pro bono medical services in Vermont as out-of-state physician","1","(c)","","","2023 legislative session and all 2023 regulatory rulemaking","","Occupational & professional licensure & certification","Health care|Physicians","N/A (background check, general relief)","Background Check","N/A (background check, general relief)"
"26 V.S.A. § 1658","http://legislature.vermont.gov/statutes/section/26/029/01658","Deny anesthesiologist assistant certification","1","(a)(5)","","","2023 legislative session and all 2023 regulatory rulemaking","","Occupational & professional licensure & certification","Health care","Any felony|Any misdemeanor","Discretionary","Indefinite"
"26 V.S.A. § 2121","http://legislature.vermont.gov/statutes/section/26/038/02121","Deny/suspend/revoke physical therapist license","1","(a), (c)","","","2023 legislative session and all 2023 regulatory rulemaking","","Occupational & professional licensure & certification","Health care","Any felony|Any misdemeanor","Discretionary","Indefinite"
"26 V.S.A. § 2677","http://legislature.vermont.gov/statutes/section/26/047/02677","Deny/suspend/revoke optician's license","1","(1)","","","2023 legislative session and all 2023 regulatory rulemaking","","Occupational & professional licensure & certification","Health care|Optometry & opticians","Other","Discretionary","Indefinite"
"26 V.S.A. § 4093","http://legislature.vermont.gov/statutes/section/26/078/04093","Deny/suspend/revoke authorization to practice psychotherapy","1","(a)(2), (b)","","","2023 legislative session and all 2023 regulatory rulemaking","","Occupational & professional licensure & certification","Health care","Any felony|Any misdemeanor","Discretionary","Indefinite"
"26 V.S.A. § 4931","http://legislature.vermont.gov/statutes/section/26/095/04931","Deny/suspend/revoke applied behavior analysis license","1","(a)(8)","","","2023 legislative session and all 2023 regulatory rulemaking","","Occupational & professional licensure & certification","Health care","Any felony|Any misdemeanor","Mandatory/Automatic","Indefinite"
"3 V.S.A. § 163","http://legislature.vermont.gov/statutes/section/03/007/00163","Juvenile court diversion & record sealing","0","(a), (e) - (g)","","","2023 legislative session and all 2023 regulatory rulemaking","","General Relief Provision","Deferred adjudication & diversion|Expungement, sealing & criminal record access restrictions","N/A (background check, general relief)","N/A - General Relief","N/A (background check, general relief)"
"3 V.S.A. § 164","http://legislature.vermont.gov/statutes/section/03/007/00164","Adult court diversion & record sealing","0","(a), (e) - (g)","","","2023 legislative session and all 2023 regulatory rulemaking","","General Relief Provision","Deferred adjudication & diversion|Expungement, sealing & criminal record access restrictions","N/A (background check, general relief)","N/A - General Relief","N/A (background check, general relief)"
"31 V.S.A. § 661","http://legislature.vermont.gov/statutes/section/31/014/00661","Ineligible for license to sell lottery tickets","1","(1)","","","2023 legislative session and all 2023 regulatory rulemaking","","Employment & volunteering|Business licensure & participation","Gaming, lottery & racing","Any felony","Mandatory/Automatic","Time-limited"
"32 V.S.A. § 10204","http://legislature.vermont.gov/statutes/section/32/239/10204","Ineligible for gaming manufacturer/distributor license (conviction of owner/officer/director)","1","(a), (b)","","","2023 legislative session and all 2023 regulatory rulemaking","","Employment & volunteering|Business licensure & participation","Gaming, lottery & racing","Any felony","Mandatory/Automatic","Time-limited"
"33 V.S.A. § 143","http://www.leg.state.vt.us/statutes/fullsection.cfm?Title=33&Chapter=001&Section=00143","Suspend provider participation in medical assistance program","1","(a), (c)","","","2023 legislative session and all 2023 regulatory rulemaking","","Government contracting & program participation","Health care|Medicaid, Medicare & other public health benefits","Crimes involving fraud, dishonesty, misrepresentation or money-laundering","Discretionary","Indefinite"
"33 V.S.A. § 4916","http://legislature.vermont.gov/statutes/section/33/049/04916","Register on Child Protection Registry","1","All","Relief:
CVR 13-172-300 
33 V.S.A. § 4916c","","2023 legislative session and all 2023 regulatory rulemaking","","Registration, publication & notification","Child care providers & youth programs","Crimes of violence, including 'person offenses'|Sex offenses","Discretionary","Indefinite"
"33 V.S.A. § 5287","http://legislature.vermont.gov/statutes/section/33/052/05287","Youthful Offender probation diversion/expungement","0","All","","","2023 legislative session and all 2023 regulatory rulemaking","","General Relief Provision","Deferred adjudication & diversion|Expungement, sealing & criminal record access restrictions","N/A (background check, general relief)","N/A - General Relief","N/A (background check, general relief)"
"33 V.S.A. § 6914","http://legislature.vermont.gov/statutes/section/33/069/06914","Background check to provide services to vulnerable adults","1","All","","","2023 legislative session and all 2023 regulatory rulemaking","","Political & civic participation|Employment & volunteering","Adult care, nursing homes & residential care facilities","N/A (background check, general relief)","Background Check","N/A (background check, general relief)"
"6 V.S.A. § 1469","http://legislature.vermont.gov/statutes/section/06/107/01469","Suspend/revoke livestock/live poultry dealer license","1","(a), (c)","","","2023 legislative session and all 2023 regulatory rulemaking","","Business licensure & participation|Occupational & professional licensure & certification","Agriculture, livestock & food","Other","Discretionary","Indefinite"
"6 V.S.A. § 2705","http://legislature.vermont.gov/statutes/section/06/151/02705","Revoke milk handler's license","1","(a)","","","2023 legislative session and all 2023 regulatory rulemaking","","Business licensure & participation|Occupational & professional licensure & certification","Agriculture, livestock & food","Other","Discretionary","Indefinite"
"6 V.S.A. § 498","http://legislature.vermont.gov/statutes/section/06/032/00498","Suspend/revoke maple products dealer/processor license","1","(a), (b)","","","2023 legislative session and all 2023 regulatory rulemaking","","Business licensure & participation|Occupational & professional licensure & certification","Agriculture, livestock & food","Other","Discretionary","Indefinite"
"6 V.S.A. § 762","http://legislature.vermont.gov/statutes/section/06/063/00762","Deny livestock dealers' license","1","(b)","","","2023 legislative session and all 2023 regulatory rulemaking","","Business licensure & participation|Occupational & professional licensure & certification","Agriculture, livestock & food","Other","Discretionary","Indefinite"
"8 V.S.A. § 11601","http://legislature.vermont.gov/statutes/section/08/201/11601","Discharge from employment with financial institution","1","(a)(6)(B)","","","2023 legislative session and all 2023 regulatory rulemaking legislative session ","","Employment & volunteering","Banking, lending, securities & finance","Other|Crimes involving fraud, dishonesty, misrepresentation or money-laundering","Discretionary","Indefinite"
"8 V.S.A. § 2240","http://legislature.vermont.gov/statutes/chapter/08/073","Background check for lender license (Nationwide Mortgage Licensing System & Registry)","1","All","See also: 
8 V.S.A. § 2257","","2023 legislative session and all 2023 regulatory rulemaking","","Business licensure & participation|Occupational & professional licensure & certification","Banking, lending, securities & finance","N/A (background check, general relief)","Background Check","N/A (background check, general relief)"
"8 V.S.A. § 3692","http://legislature.vermont.gov/statutes/section/08/101/03692","Suspend/revoke insurer's license","1","All","","","2023 legislative session and all 2023 regulatory rulemaking","","Business licensure & participation|Occupational & professional licensure & certification","Insurance sales & services","Other","Discretionary","Indefinite"
"8 V.S.A. § 4488","http://legislature.vermont.gov/statutes/section/08/121/04488","Suspend/revoke fraternal benefit society agent license","1","(6)(a)(i)","","","2023 legislative session and all 2023 regulatory rulemaking","","Occupational & professional licensure & certification","Insurance sales & services","Any felony|Any misdemeanor","Discretionary","Indefinite"
"8 V.S.A. § 4674","http://legislature.vermont.gov/statutes/section/08/127/04674","Impose motor vehicle insurance surcharge","1","All","","","2023 legislative session and all 2023 regulatory rulemaking","","Civil fines, liability, forfeiture & property rights","Driving & noncommercial motor vehicles","Any felony|Any misdemeanor","Discretionary","Indefinite"
"9 V.S.A. § 2473","http://legislature.vermont.gov/statutes/section/09/063/02473","Ineligible for employment as paid solicitor for fundraising campaign","1","(a)(6)","","","2023 legislative session and all 2023 regulatory rulemaking","","Employment & volunteering","Fundraising, charities & nonprofits","Any felony|Crimes involving fraud, dishonesty, misrepresentation or money-laundering","Discretionary","Indefinite"
"9 V.S.A. § 2726","http://legislature.vermont.gov/statutes/section/09/073/02726","Suspend/revoke certificate of registered dealer/service person of weights and measure devices","1","All","","","2023 legislative session and all 2023 regulatory rulemaking","","Business licensure & participation|Occupational & professional licensure & certification","Weights & measures","Other","Discretionary","Indefinite"
"9 V.S.A. § 4467","http://legislature.vermont.gov/statutes/section/09/137/04467","Terminate residential rental agreement","1","(b)(2)","","","2023 legislative session and all 2023 regulatory rulemaking","","Housing & residency","Real estate & property","Any felony|Any misdemeanor","Discretionary","Indefinite"
"CVR 04-030-130","https://www.lexisnexis.com/hottopics/codeofvtrules/","Deny/suspend/revoke land surveyor license","1","8.1","","","2023 legislative session and all 2023 regulatory rulemaking","","Occupational & professional licensure & certification","Construction, improvement & repair, engineering, plumbing, HVAC, surveying, design & architecture","Any felony|Any misdemeanor","Discretionary","Indefinite"
"CVR 04-030-370","https://www.lexisnexis.com/hottopics/codeofvtrules/","Report convictions of licensed electrologist to Office of Professional Regulation","1","7.1(D)","","","2023 legislative session and all 2023 regulatory rulemaking","","Occupational & professional licensure & certification","Cosmetology, barbering, electrology, tattooing & body art","Any felony|Any misdemeanor","Mandatory/Automatic","Indefinite"
"CVR 12-010-042","https://www.lexisnexis.com/hottopics/codeofvtrules/","Ineligible for appointment as wildlife rehabilitator","1","3(a)(2)","","","2023 legislative session and all 2023 regulatory rulemaking","","Employment & volunteering","Wildlife, fish & game","Any felony|Any misdemeanor","Discretionary","Indefinite"
"CVR 13-110-006","https://www.lexisnexis.com/hottopics/codeofvtrules/","Ineligible for employment at home for the terminally ill","1","5.10(d)","","","2023 legislative session and all 2023 regulatory rulemaking","","Employment & volunteering","Health care|Adult care, nursing homes & residential care facilities","Crimes involving fraud, dishonesty, misrepresentation or money-laundering","Mandatory/Automatic","Indefinite"
