Citation,Citation URL,Title,Number of Consequences,Relevant Subsections,Related Statutes,Notes,Current Through,Jurisdiction,Consequences,Keywords,Offense Type,Discretion,Duration
"481 IAC 105.11","https://www.legis.iowa.gov/law/administrativeRules/rules?agency=481&chapter=105","Deny registration for amusement device/manufacturer/distributor/owner/representative","1","(1)(a)-(b)
(2)(d)
(3)","Other triggering offenses:
Gambling offenses

Additional offense details:
","","2023 legislative session and all 2023 regulatory rulemaking","","Employment & volunteering|Business licensure & participation","Gaming, lottery & racing|Entertainment, athletics, news & broadcasting","Other","Discretionary","Time-limited"
"481 IAC 30.10","https://www.legis.iowa.gov/law/administrativeRules/rules?agency=481&chapter=30","Suspend/revoke food establishment license","1","(2)(a)(1)-(2)
(2)(b)(1)-(2)
(2)(c)-(d)","","","2023 legislative session and all 2023 regulatory rulemaking","","Employment & volunteering|Business licensure & participation","Agriculture, livestock & food","Any felony|Any misdemeanor","Discretionary","Indefinite"
"481 IAC 37.10","https://www.legis.iowa.gov/law/administrativeRules/rules?agency=481&chapter=37","Suspend/revoke hotel/motel license","1","(1)(a)-(b)
(2)(a)-(b)
(3)-(4)","","","2023 legislative session and all 2023 regulatory rulemaking","","Business licensure & participation","Real estate & property|Immigration, naturalization & travel","Any felony|Any misdemeanor","Discretionary","Indefinite"
"481 IAC 51.41","https://www.legis.iowa.gov/law/administrativeRules/rules?agency=481&chapter=51","Ineligible for employment in hospital","1","All","","","2023 legislative session and all 2023 regulatory rulemaking","","Employment & volunteering|Occupational & professional licensure & certification","Health care","Any felony|Any misdemeanor","Discretionary (waiver)","Indefinite"
"481 IAC 51.41","https://www.legis.iowa.gov/law/administrativeRules/rules?agency=481&chapter=51","Ineligible to change employing hospital without evaluation","1","All","","","2023 legislative session and all 2023 regulatory rulemaking","","Employment & volunteering|Occupational & professional licensure & certification","Health care","Any felony|Any misdemeanor","Mandatory/Automatic","Indefinite"
"481 IAC 57.11","https://www.legis.iowa.gov/law/administrativeRules/rules?agency=481&chapter=57","Deny employment at residential care facility","1","3, 4","See also:
Iowa Code § 135C.33
481 IAC 50.9","","2023 legislative session and all 2023 regulatory rulemaking","","Employment & volunteering","Health care|Adult care, nursing homes & residential care facilities","Any felony|Any misdemeanor","Discretionary (waiver)","Indefinite"
"481 IAC 58.11","https://www.legis.iowa.gov/law/administrativeRules/rules?agency=481&chapter=58","Ineligible for employment at nursing facility","1","(2)(m)","See also:
Iowa Code § 135C.33
481 IAC 50.9","","2023 legislative session and all 2023 regulatory rulemaking","","Employment & volunteering","Health care|Adult care, nursing homes & residential care facilities","Any felony|Any misdemeanor","Discretionary (waiver)","Indefinite"
"531 IAC 12.1","https://www.legis.iowa.gov/law/administrativeRules/rules?agency=531&chapter=12","Ineligible for retail lottery sales license","1","(1)(a)-(b)","Background check:
 531 IAC 12.4

Other triggering offenses:
Gambling-related offenses","","2023 legislative session and all 2023 regulatory rulemaking","","Employment & volunteering|Business licensure & participation","Gaming, lottery & racing","Other|Crimes involving fraud, dishonesty, misrepresentation or money-laundering","Mandatory/Automatic","Indefinite"
"531 IAC 14.19","https://www.legis.iowa.gov/law/administrativeRules/rules?agency=531&chapter=14","Ineligible for lottery monitor vending machine manufacturer certification (conviction of bidder/employee)","1","1, 7","See also:
531 IAC 2.16","","2023 legislative session and all 2023 regulatory rulemaking","","Government contracting & program participation|Employment & volunteering|Business licensure & participation","Gaming, lottery & racing","Any felony","Mandatory/Automatic","Indefinite"
"567 IAC 81.17","https://www.legis.iowa.gov/law/administrativeRules/rules?agency=567&chapter=81","Deny/suspend/revoke public water supply system/wastewater treatment operator certification","2","(1)(h), (2)-(4)","See also:
Iowa Code § 726.5","","2023 legislative session and all 2023 regulatory rulemaking","","Employment & volunteering|Occupational & professional licensure & certification","Conservation, environmental sciences & water","Any felony|Child Support offenses","Varies","Varies"
"571 IAC 12.25","https://www.legis.iowa.gov/law/administrativeRules/rules?agency=571&chapter=12","Suspend/revoke volunteer instructor certification for recreational licenses","1","(5), (11)","","","2023 legislative session and all 2023 regulatory rulemaking","","Recreational license & participation, including firearms|Occupational & professional licensure & certification","","Any felony|Any misdemeanor|Recreational license offenses","Discretionary","Indefinite"
"641 IAC 154.17","https://www.legis.iowa.gov/law/administrativeRules/rules?agency=641&chapter=154","Background check to be an employee of a medical cannabidiol manufacturer","1","(3)","","","2023 legislative session and all 2023 regulatory rulemaking","","Employment & volunteering","Health care|Pharmacy & drugs|Marijuana (medical & recreational)","N/A (background check, general relief)","Background Check","N/A (background check, general relief)"
"641 IAC 154.41","https://www.legis.iowa.gov/law/administrativeRules/rules?agency=641&chapter=154","Ineligible to employ a person at a medical cannabidiol dispensary (person under 18)","1","(2)(b)(11), (3)","","","2023 legislative session and all 2023 regulatory rulemaking","","Employment & volunteering","Health care|Pharmacy & drugs|Marijuana (medical & recreational)","Any felony","Mandatory/Automatic","Indefinite"
"641 IAC 155.21","https://www.legis.iowa.gov/law/administrativeRules/rules?agency=641&chapter=155","Ineligible for employment working with juveniles/dependent adults at substance abuse/problem gambling treatment program","1","(9)(a)-(c)","","","2023 legislative session and all 2023 regulatory rulemaking","","Employment & volunteering","Health care|Psychiatry, psychology, counseling & mental health services","Any felony|Any misdemeanor","Discretionary (waiver)","Indefinite"
"641 IAC 22.7","https://www.legis.iowa.gov/law/administrativeRules/rules?agency=641&chapter=22","Deny tattoo permit (applicants)","1","(2)","","","2023 legislative session and all 2023 regulatory rulemaking","","Employment & volunteering|Occupational & professional licensure & certification","Cosmetology, barbering, electrology, tattooing & body art","Any felony|Any misdemeanor","Discretionary","Indefinite"
"645 IAC 103.3","https://www.legis.iowa.gov/law/administrativeRules/rules?agency=645&chapter=103","Suspend/revoke funeral director license","1","(8), (10)(c), (12)","See also:
645 IAC 103.5","","2023 legislative session and all 2023 regulatory rulemaking","","Employment & volunteering|Occupational & professional licensure & certification","Funeral services","Any felony|Any misdemeanor","Discretionary","Indefinite"
"645 IAC 103.4","https://www.legis.iowa.gov/law/administrativeRules/rules?agency=645&chapter=103","Deny/suspend/revoke funeral/cremation establishment license (conviction of officer/owner)","1","1","See also:
645 IAC 103.5","","2023 legislative session and all 2023 regulatory rulemaking","","Employment & volunteering|Business licensure & participation","Funeral services","Any felony|Any misdemeanor","Discretionary","Indefinite"
"645 IAC 25.2","https://www.legis.iowa.gov/law/administrativeRules/rules?agency=645&chapter=25","Suspend/revoke barber/barbershop/barber school license","1","(11), (12), (15)","See also:
645 IAC 25.3","","2023 legislative session and all 2023 regulatory rulemaking","","Employment & volunteering|Occupational & professional licensure & certification","Cosmetology, barbering, electrology, tattooing & body art","Any felony|Any misdemeanor","Discretionary","Indefinite"
"645 IAC 283.2","https://www.legis.iowa.gov/law/administrativeRules/rules?agency=645&chapter=283","Suspend/revoke social worker license","1","(11), (12), (15)","See also:
645 IAC 283.3","","2023 legislative session and all 2023 regulatory rulemaking","","Employment & volunteering|Occupational & professional licensure & certification","Social work & child welfare","Any felony|Any misdemeanor","Discretionary","Indefinite"
"645 IAC 363.2","https://www.legis.iowa.gov/law/administrativeRules/rules?agency=645&chapter=363","Suspend/revoke sign language interpreter/transliterator license","1","(11), (12), (15)","See also:
645 IAC 363.3","","2023 legislative session and all 2023 regulatory rulemaking","","Employment & volunteering|Occupational & professional licensure & certification","Interpreters","Any felony|Any misdemeanor","Discretionary","Indefinite"
"645 IAC 65.2","https://www.legis.iowa.gov/law/administrativeRules/rules?agency=645&chapter=65","Suspend/revoke cosmetology license","1","(12), (13), (16)","See also:
645 IAC 65.3","","2023 legislative session and all 2023 regulatory rulemaking","","Employment & volunteering|Occupational & professional licensure & certification","Cosmetology, barbering, electrology, tattooing & body art","Any felony|Any misdemeanor","Discretionary","Indefinite"
"650 IAC 11.2","https://www.legis.iowa.gov/law/administrativeRules/rules?agency=650&chapter=11","Background check for dentist/dental hygienist license","1","(2)(e)-(f), (2)(i)","","","2023 legislative session and all 2023 regulatory rulemaking","","Employment & volunteering|Occupational & professional licensure & certification","Health care|Dentistry","N/A (background check, general relief)","Background Check","N/A (background check, general relief)"
"650 IAC 33.3","https://www.legis.iowa.gov/law/administrativeRules/rules?agency=650&chapter=33","Suspend/revoke dental license (child support offenses)","1","All","See also:
650 IAC 20.13
Iowa Code § 726.5","","2023 legislative session and all 2023 regulatory rulemaking","","Employment & volunteering|Occupational & professional licensure & certification","Health care|Dentistry","Child Support offenses","Mandatory/Automatic","Indefinite"
"650 IAC 52.3","https://www.legis.iowa.gov/law/administrativeRules/rules?agency=650&chapter=52","Background check for dental license by veteran reciprocity","1","(2), (4)-(6)","","","2023 legislative session and all 2023 regulatory rulemaking","","Employment & volunteering|Occupational & professional licensure & certification","Health care|Dentistry","N/A (background check, general relief)","Background Check","N/A (background check, general relief)"
"657 IAC 10.10","https://www.legis.iowa.gov/law/administrativeRules/rules?agency=657&chapter=10","Suspend/revoke registration for manufacturing/distributing/dispensing controlled substances","1","(1)(c), (2)(b)-(c)","","","2023 legislative session and all 2023 regulatory rulemaking","","Business licensure & participation","Health care|Pharmacy & drugs|Marijuana (medical & recreational)","Controlled substances offenses","Discretionary","Indefinite"
"657 IAC 17.4","https://www.legis.iowa.gov/law/administrativeRules/rules?agency=657&chapter=17","Ineligible for wholesale drug license","1","(2)-(5)","Background check:
657 IAC 17.3","","2023 legislative session and all 2023 regulatory rulemaking","","Employment & volunteering","Health care|Pharmacy & drugs","Any felony|Controlled substances offenses","Discretionary","Indefinite"
"657 IAC 3.8","https://www.legis.iowa.gov/law/administrativeRules/rules?agency=657&chapter=3","Background check for certified pharmacy technician/trainee registration","1","(2)(c)","","","2023 legislative session and all 2023 regulatory rulemaking","","Employment & volunteering|Occupational & professional licensure & certification","Health care|Pharmacy & drugs","N/A (background check, general relief)","Background Check","N/A (background check, general relief)"
"661 IAC 13.13","https://www.legis.iowa.gov/law/administrativeRules/rules?agency=661&chapter=13","Background check for appointment as special railway agent","1","All","","","2023 legislative session and all 2023 regulatory rulemaking","","Employment & volunteering","Transportation & commercial motor vehicles|Law enforcement, corrections & public safety|Public employment","N/A (background check, general relief)","Background Check","N/A (background check, general relief)"
"661 IAC 235.4","https://www.legis.iowa.gov/law/administrativeRules/rules?agency=661&chapter=235","Ineligible for commercial explosive license","1","-5","","","2023 legislative session and all 2023 regulatory rulemaking","","Employment & volunteering","Firearms, weapons & explosives|Construction, improvement & repair, engineering, plumbing, HVAC, surveying, design & architecture","Any felony|Weapons offenses","Mandatory/Automatic","Indefinite"
"681 IAC 3.55","https://www.legis.iowa.gov/law/administrativeRules/rules?agency=681&chapter=3","Ineligible for employment at state university","1","3, 6","","","2023 legislative session and all 2023 regulatory rulemaking","","Employment & volunteering","Education & schools|Teachers & instructors","Any felony|Any misdemeanor","Discretionary","Indefinite"
"761 IAC 607.49","https://www.legis.iowa.gov/law/administrativeRules/rules?agency=761&chapter=607","Ineligible for restricted commercial driver's license","1","(4)(b), (5)(c)","Other triggering offenses:
Use of a motor vehicle in the commission of a felony","","2023 legislative session and all 2023 regulatory rulemaking","","Employment & volunteering","Transportation & commercial motor vehicles","Controlled substances offenses|Motor vehicle offenses|Other","Mandatory/Automatic","Time-limited"
"761 IAC 615.29","https://www.legis.iowa.gov/law/administrativeRules/rules?agency=761&chapter=615","Revoke driver's license (mandatory for felonies involving a motor vehicle/failure to stop/fraud)","1","(1)
(2)(a)-(c)
(3)(a)-(b)","Additional offense details:
321.209","","2023 legislative session and all 2023 regulatory rulemaking","","Motor vehicle licensure (non-commercial)","Driving & noncommercial motor vehicles","Any felony|Motor vehicle offenses|Crimes involving fraud, dishonesty, misrepresentation or money-laundering","Mandatory/Automatic","Indefinite"
"875 IAC 155.8","https://www.legis.iowa.gov/law/administrativeRules/rules?agency=875&chapter=155","Deny/suspend/revoke asbestos removal/encapsulation permit (child support arrearages)","1","(1)(c)-(e), (2)-(3)","See also:
Iowa Code § 726.5","","2023 legislative session and all 2023 regulatory rulemaking","","Employment & volunteering|Occupational & professional licensure & certification","Hazardous materials, pesticides, chemicals & waste|Construction, improvement & repair, engineering, plumbing, HVAC, surveying, design & architecture","Child Support offenses","Discretionary","Indefinite"
"Iowa Code § 101A.2","https://www.legis.iowa.gov/law/iowaCode/sections?codeChapter=101A&year=2018","Background check for commercial licenses for the manufacture/importation/distribution/sale/commercial use of explosives","1","(1)(c)
(3)","","","2023 legislative session and all 2023 regulatory rulemaking","","Employment & volunteering|Occupational & professional licensure & certification","Firearms, weapons & explosives","Any felony|Any misdemeanor","Discretionary","Indefinite"
"Iowa Code § 123A.3","https://www.legis.iowa.gov/law/iowaCode/sections?codeChapter=123A&year=2018","Terminate wholesaler's contract with brewer","1","
(5)(e)","","","2023 legislative session and all 2023 regulatory rulemaking","","Business licensure & participation","Business contracts (private) & dissolution|Alcohol permits, licenses & sales","Any felony|Any misdemeanor","Mandatory/Automatic","Indefinite"
"Iowa Code § 137C.10","https://www.legis.iowa.gov/law/iowaCode/sections?codeChapter=137C&year=2018","Suspend/revoke license to operate hotel","1","3","","","2023 legislative session and all 2023 regulatory rulemaking","","Business licensure & participation","Real estate & property|Immigration, naturalization & travel","Any felony|Any misdemeanor","Discretionary","Indefinite"
"Iowa Code § 148A.7","https://www.legis.iowa.gov/law/iowaCode/sections?codeChapter=148A&year=2018","Suspend/revoke physical therapy license (false credentials)","1","(1)-(3)","","","2023 legislative session and all 2023 regulatory rulemaking","","Employment & volunteering|Occupational & professional licensure & certification","Health care|Physical & occupational therapy","Crimes involving fraud, dishonesty, misrepresentation or money-laundering","Mandatory/Automatic","Indefinite"
"Iowa Code § 153.34","https://www.legis.iowa.gov/law/iowaCode/sections?codeChapter=153&year=2018","Revoke/suspend dentist/dental hygienist/assistant license","1","9","","","2023 legislative session and all 2023 regulatory rulemaking","","Occupational & professional licensure & certification","Health care|Dentistry","Any felony|Any misdemeanor","Discretionary","Indefinite"
"Iowa Code § 155A.12","https://www.legis.iowa.gov/law/iowaCode/sections?codeChapter=155A&year=2018","Deny/suspend/revoke pharmacist/pharmacy technician/license (controlled substance convictions)","1","(8), (9)","Background check:
 Iowa Code § 155A.40

See also:
Iowa Code § 155A.24","","2023 legislative session and all 2023 regulatory rulemaking","","Employment & volunteering|Occupational & professional licensure & certification","Health care|Pharmacy & drugs","Controlled substances offenses","Discretionary","Indefinite"
"Iowa Code § 156.15","https://www.legis.iowa.gov/law/iowaCode/sections?codeChapter=156&year=2018","Deny/suspend/revoke funeral parlor/cremation establishment license (conviction of licensee/managing officer/owner)","1","(1)
(2)(a)","","","2023 legislative session and all 2023 regulatory rulemaking","","Employment & volunteering|Business licensure & participation","Funeral services","Any felony|Any misdemeanor","Discretionary","Indefinite"
"Iowa Code § 169.13","https://www.legis.iowa.gov/law/iowaCode/sections?codeChapter=169&year=2018","Suspend/revoke veterinary license","1","(1)(b)-(c)","","","2023 legislative session and all 2023 regulatory rulemaking","","Employment & volunteering|Occupational & professional licensure & certification","Veterinarians","Any felony|Any misdemeanor","Discretionary","Indefinite"
"Iowa Code § 232C.3","https://www.legis.iowa.gov/law/iowaCode/sections?codeChapter=232C&year=2018","Deny petition by minor for emancipation","1","(1)(d)","","","2023 legislative session and all 2023 regulatory rulemaking","","Family & domestic rights|Judicial Rights","Child custody, visitation & parental rights","Any felony|Any misdemeanor","Discretionary","Indefinite"
"Iowa Code § 237.8","https://www.legis.iowa.gov/law/iowaCode/sections?codeChapter=237&year=2018","Ineligible for foster parent license","2","(2)-(6)","","","2023 legislative session and all 2023 regulatory rulemaking","","Family & domestic rights","Adoption & foster care","Controlled substances offenses|Crimes of violence, including 'person offenses'|Sex offenses","Mandatory/Automatic","Varies"
"Iowa Code § 237.8","https://www.legis.iowa.gov/law/iowaCode/sections?codeChapter=237&year=2018","Deny residency at foster care facility home","1","(2)-(5)","","","2023 legislative session and all 2023 regulatory rulemaking","","Family & domestic rights|Housing & residency","Adoption & foster care","Any felony|Any misdemeanor","Mandatory/Automatic","Indefinite"
"Iowa Code § 249A.29","https://www.legis.iowa.gov/law/iowaCode/sections?codeChapter=249A&year=2018","Ineligible for employment at a certified home/community based services provider","1","(1)(b)-(c)
(2)-(5)","","","2023 legislative session and all 2023 regulatory rulemaking","","Employment & volunteering","Health care|Adult care, nursing homes & residential care facilities","Any felony|Any misdemeanor","Discretionary","Indefinite"
"Iowa Code § 321.12","https://www.legis.iowa.gov/law/iowaCode/sections?codeChapter=321&year=2018","Expunge record of non-DUI motor vehicle conviction (relief)","0","(4)","","","2023 legislative session and all 2023 regulatory rulemaking","","General Relief Provision","Transportation & commercial motor vehicles|Driving & noncommercial motor vehicles|Expungement, sealing & criminal record access restrictions","N/A (background check, general relief)","N/A - General Relief","N/A (background check, general relief)"
"Iowa Code § 321.188","https://www.legis.iowa.gov/law/iowaCode/sections?codeChapter=321&year=2018","Ineligible for waiver of driver skills test for commercial driver's license","1","(1)(b), (2)(b), (4), (6)(a)(2)-(5)","See also:
49 C.F.R. § 383.51","","2023 legislative session and all 2023 regulatory rulemaking","","Employment & volunteering","Transportation & commercial motor vehicles","Controlled substances offenses|Crimes of violence, including 'person offenses'|Motor vehicle offenses","Mandatory/Automatic","Time-limited"
"Iowa Code § 321.208","https://www.legis.iowa.gov/law/iowaCode/sections?codeChapter=321&year=2018","Ineligible to operate commercial motor vehicle (1 year for enumerated offenses)","7","All","Relief:
49 C.F.R. § 383.51","","2023 legislative session and all 2023 regulatory rulemaking","","Employment & volunteering","Transportation & commercial motor vehicles","Controlled substances offenses|Crimes of violence, including 'person offenses'|Motor vehicle offenses","Mandatory/Automatic","Varies"
"Iowa Code § 321.218","https://www.legis.iowa.gov/law/iowaCode/sections?codeChapter=321&year=2018","Suspend/revoke driver's license/commercial driver's license (driving during suspension/revocation period)","1","All","See also:
Iowa Code § 321.241","","2023 legislative session and all 2023 regulatory rulemaking","","Motor vehicle licensure (non-commercial)|Occupational & professional licensure & certification","Transportation & commercial motor vehicles|Driving & noncommercial motor vehicles","Motor vehicle offenses","Mandatory/Automatic","Conditional"
"Iowa Code § 321.489","https://www.legis.iowa.gov/law/iowaCode/sections?codeChapter=321&year=2018","Limit use of conviction for driving offense in civil action (relief)","0","All","","","2023 legislative session and all 2023 regulatory rulemaking","","General Relief Provision","Civil litigation & administrative proceedings|Judicial evidence & witnesses|Limitations on imposition of collateral consequences","N/A (background check, general relief)","N/A - General Relief","N/A (background check, general relief)"
"Iowa Code § 321.490","https://www.legis.iowa.gov/law/iowaCode/sections?codeChapter=321&year=2018","Limit use of non-felony traffic conviction to impeach credibility in other court proceedings (relief)","0","All","","","2023 legislative session and all 2023 regulatory rulemaking","","General Relief Provision","Civil litigation & administrative proceedings|Judicial evidence & witnesses|Limitations on imposition of collateral consequences","N/A (background check, general relief)","N/A - General Relief","N/A (background check, general relief)"
"Iowa Code § 321.491","https://www.legis.iowa.gov/law/iowaCode/sections?codeChapter=321&year=2018","Remove from office (misconduct for failure to report driving offenses)","1","(1)
(2)(a)-(c)
(3)-(5)","See also:
Iowa Code § 721.2","","2023 legislative session and all 2023 regulatory rulemaking","","Political & civic participation|Employment & volunteering","Public employment|Public office","Public corruption offenses","Discretionary","Indefinite"
"Iowa Code § 321H.6","https://www.legis.iowa.gov/law/iowaCode/sections?codeChapter=321H&year=2018","Deny/suspend/revoke vehicle recycler license","1","3","","","2023 legislative session and all 2023 regulatory rulemaking","","Business licensure & participation","Motor vehicle sales & service","Any felony|Any misdemeanor|Crimes involving fraud, dishonesty, misrepresentation or money-laundering","Discretionary","Indefinite"
"Iowa Code § 321J.4","https://www.legis.iowa.gov/law/iowaCode/sections?codeChapter=321J&year=2018","Revoke driver's license (DUI)","1","All","","","2023 legislative session and all 2023 regulatory rulemaking","","Motor vehicle licensure (non-commercial)|Business licensure & participation","Driving & noncommercial motor vehicles","Controlled substances offenses|Motor vehicle offenses","Mandatory/Automatic","Time-limited"
"Iowa Code § 322.6","https://www.legis.iowa.gov/law/iowaCode/sections?codeChapter=322&year=2018","Deny motor vehicle dealer license","1","(1)(d), (i), (j), (2), (4)","","","2023 legislative session and all 2023 regulatory rulemaking","","Motor vehicle licensure (non-commercial)","Motor vehicle sales & service","Any felony|Any misdemeanor|Crimes involving fraud, dishonesty, misrepresentation or money-laundering","Discretionary","Indefinite"
"Iowa Code § 322.9","https://www.legis.iowa.gov/law/iowaCode/sections?codeChapter=322&year=2018","Suspend/revoke motor vehicle dealer license","1","All","See also:
Iowa Code § 322.6","","2023 legislative session and all 2023 regulatory rulemaking","","Motor vehicle licensure (non-commercial)","Motor vehicle sales & service","Any felony|Any misdemeanor|Crimes involving fraud, dishonesty, misrepresentation or money-laundering","Discretionary","Indefinite"
