Citation,Citation URL,Title,Number of Consequences,Relevant Subsections,Related Statutes,Notes,Current Through,Jurisdiction,Consequences,Keywords,Offense Type,Discretion,Duration
"Iowa Code § 125.14A","https://www.legis.iowa.gov/law/iowaCode/sections?codeChapter=125&year=2018","Deny residence in a juvenile substance abuse program facility","1","All","","","2023 legislative session and all 2023 regulatory rulemaking","","Family & domestic rights|Housing & residency","Health care|Psychiatry, psychology, counseling & mental health services","Any felony|Any misdemeanor","Discretionary","Indefinite"
"Iowa Code § 135H.7","https://www.legis.iowa.gov/law/iowaCode/sections?codeChapter=135H&year=2018","Deny residence in a children's psychiatric institution","1","(2)-(6)","","","2023 legislative session and all 2023 regulatory rulemaking","","Family & domestic rights|Housing & residency","Health care|Psychiatry, psychology, counseling & mental health services","Any felony|Any misdemeanor","Discretionary","Indefinite"
"Iowa Code § 142A.3","https://www.legis.iowa.gov/law/iowaCode/sections?codeChapter=142A&year=2018","Remove from tobacco use prevention and control commission","1","(1)-(2)
(7)","","","2023 legislative session and all 2023 regulatory rulemaking","","Political & civic participation|Employment & volunteering","Tobacco|Public employment|Public office","Controlled substances offenses","Discretionary","Indefinite"
"Iowa Code § 148.6","https://www.legis.iowa.gov/law/iowaCode/sections?codeChapter=148&year=2018","Suspend/revoke license to practice medicine","1","(2)(b), (3)","See also:
Iowa Code §147.55","","2023 legislative session and all 2023 regulatory rulemaking","","Employment & volunteering|Occupational & professional licensure & certification","Health care|Physicians","Any felony|Any misdemeanor","Discretionary","Indefinite"
"Iowa Code § 154A.24","https://www.legis.iowa.gov/law/iowaCode/sections?codeChapter=154A&year=2018","Suspend/revoke hearing aid sales license","1","(2)(r)","","","2023 legislative session and all 2023 regulatory rulemaking","","Employment & volunteering|Occupational & professional licensure & certification","Health care|Sales & service (general)|Audiology, speech & hearing aids","Any felony","Discretionary","Indefinite"
"Iowa Code § 217.45","https://www.legis.iowa.gov/law/iowaCode/sections?codeChapter=217&year=2018","Background check for contractor/vendor/employee (access to federal tax information)","1","All","","","2023 legislative session and all 2023 regulatory rulemaking","","Government contracting & program participation|Employment & volunteering","Public employment|Sensitive information access|Government procurement contracts & programs","N/A (background check, general relief)","Background Check","N/A (background check, general relief)"
"Iowa Code § 321.209","https://www.legis.iowa.gov/law/iowaCode/sections?codeChapter=321&year=2018","Revoke driver's license","1","(1)-(7)","","","2023 legislative session and all 2023 regulatory rulemaking","","Motor vehicle licensure (non-commercial)","Driving & noncommercial motor vehicles","Any felony|Crimes of violence, including 'person offenses'|Motor vehicle offenses|Crimes involving fraud, dishonesty, misrepresentation or money-laundering","Mandatory/Automatic","Indefinite"
"Iowa Code § 321A.17","https://www.legis.iowa.gov/law/iowaCode/sections?codeChapter=321A&year=2018","Suspend motor vehicle registration","1","All","","","2023 legislative session and all 2023 regulatory rulemaking","","Motor vehicle licensure (non-commercial)","Driving & noncommercial motor vehicles","Any felony|Any misdemeanor|Controlled substances offenses|Motor vehicle offenses","Mandatory/Automatic","Conditional"
"Iowa Code § 322C.3","https://www.legis.iowa.gov/law/iowaCode/sections?codeChapter=322C&year=2018","Ineligible to owner/employee/officer/representative of a licensed travel trailer dealer","1","10","","","2023 legislative session and all 2023 regulatory rulemaking","","Employment & volunteering","Transportation & commercial motor vehicles|Motor vehicle sales & service","Any felony|Any misdemeanor|Crimes involving fraud, dishonesty, misrepresentation or money-laundering","Mandatory/Automatic","Time-limited"
"Iowa Code § 410.8","https://www.legis.iowa.gov/law/iowaCode/sections?codeChapter=410&year=2018","Forfeit firefighter/police officer disability pension","1","All","","","2023 legislative session and all 2023 regulatory rulemaking","","Government benefits","Social Security, SSI, unemployment & disability benefits|Retirement & pensions|Law enforcement, corrections & public safety|Emergency services, management & fire","Any felony","Mandatory/Automatic","Indefinite"
"Iowa Code § 411.6","https://www.legis.iowa.gov/law/iowaCode/sections?codeChapter=411&year=2018","Ineligible for firefighter/police officer disability retirement","1","(16)(b)","","","2023 legislative session and all 2023 regulatory rulemaking","","Government benefits","Social Security, SSI, unemployment & disability benefits|Retirement & pensions|Law enforcement, corrections & public safety|Emergency services, management & fire","Any felony","Discretionary","Indefinite"
"Iowa Code § 411.6","https://www.legis.iowa.gov/law/iowaCode/sections?codeChapter=411&year=2018","Assign police/firefighter retirement payments to spouse/child","1","(17)(a)(1)-(2)
(17)(b)(1)-(2)","Additional offense details:
Iowa Code § 411.1","","2023 legislative session and all 2023 regulatory rulemaking","","Government benefits","Social Security, SSI, unemployment & disability benefits|Retirement & pensions|Law enforcement, corrections & public safety|Emergency services, management & fire","Any felony","Mandatory/Automatic","Time-limited"
"Iowa Code § 453A.5","https://www.legis.iowa.gov/law/iowaCode/sections?codeChapter=453A&year=2018","Revoke tobacco compliance employee training certificate","1","(3)","","","2023 legislative session and all 2023 regulatory rulemaking","","Employment & volunteering|Business licensure & participation","Tobacco|Education & schools|Teachers & instructors","Controlled substances offenses","Mandatory/Automatic","Indefinite"
"Iowa Code § 455B.307B","https://www.legis.iowa.gov/law/iowaCode/sections?codeChapter=455B&year=2018","Ineligible to serve as an illegal dumping enforcement officer","1","2","","","2023 legislative session and all 2023 regulatory rulemaking","","Political & civic participation|Employment & volunteering","Public employment|Public office|Hazardous materials, pesticides, chemicals & waste","Any felony","Mandatory/Automatic","Indefinite"
"Iowa Code § 462A.23","https://www.legis.iowa.gov/law/iowaCode/sections?codeChapter=462A&year=2018","Revoke registration certificate for vessel/commercial vessel","1","(2)(a)-(d)
(3)(a), (6)(c)","","","2023 legislative session and all 2023 regulatory rulemaking","","Recreational license & participation, including firearms","Maritime & sea vessels","Controlled substances offenses|Crimes of violence, including 'person offenses'|Crimes involving fraud, dishonesty, misrepresentation or money-laundering|Recreational license offenses","Mandatory/Automatic","Indefinite"
"Iowa Code § 490.851","https://www.legis.iowa.gov/law/iowaCode/sections?codeChapter=490&year=2018","Deny indemnification by corporation (conviction of director/officer)","1","3","","","2023 legislative session and all 2023 regulatory rulemaking","","Business licensure & participation|Civil fines, liability, forfeiture & property rights","Business contracts (private) & dissolution|Civil litigation & administrative proceedings","Any felony|Any misdemeanor","Discretionary","Indefinite"
"Iowa Code § 502A.4","https://www.legis.iowa.gov/law/iowaCode/sections?codeChapter=502A&year=2018","Suspend/revoke precious metals commodities seller authorization (conviction of officer/director/employee)","1","(4)(b)","","","2023 legislative session and all 2023 regulatory rulemaking","","Employment & volunteering|Business licensure & participation|Occupational & professional licensure & certification","Banking, lending, securities & finance","Any felony|Any misdemeanor","Discretionary","Time-limited"
"Iowa Code § 512B.9","https://www.legis.iowa.gov/law/iowaCode/sections?codeChapter=512B&year=2018","Ineligible for indemnification by fraternal benefit society (convictions of directors/agents)","1","(1)
(2)(a)-(c)
(3)-(4)","","","2023 legislative session and all 2023 regulatory rulemaking","","Business licensure & participation|Civil fines, liability, forfeiture & property rights","Insurance sales & services|Civil litigation & administrative proceedings","Any felony|Any misdemeanor","Discretionary","Indefinite"
"Iowa Code § 515D.4","https://www.legis.iowa.gov/law/iowaCode/sections?codeChapter=515D&year=2018","Cancel motor vehicle insurance","1","(2)(c)(1)-(3)","See also:
Iowa Code § 321.261","","2023 legislative session and all 2023 regulatory rulemaking","","Motor vehicle licensure (non-commercial)|Civil fines, liability, forfeiture & property rights","Insurance sales & services|Motor vehicle sales & service","Controlled substances offenses|Motor vehicle offenses","Discretionary","Time-limited"
"Iowa Code § 533A.3","https://www.legis.iowa.gov/law/iowaCode/sections?codeChapter=533A&year=2018","Ineligible for debt management license (conviction of applicant/owner/partner/member/manager)","1","(3)(a)(2)
","","","2023 legislative session and all 2023 regulatory rulemaking","","Employment & volunteering|Business licensure & participation|Occupational & professional licensure & certification","Credit, debt services, bankruptcy & repossession","Any felony|Any misdemeanor","Mandatory/Automatic","Indefinite"
"Iowa Code § 533A.7","https://www.legis.iowa.gov/law/iowaCode/sections?codeChapter=533A&year=2018","Suspend/revoke debt management license (conviction of owner/partner/officer/manager)","1","1(a)-(b), 2-6","","","2023 legislative session and all 2023 regulatory rulemaking","","Employment & volunteering|Business licensure & participation|Occupational & professional licensure & certification","Credit, debt services, bankruptcy & repossession","Any felony|Any misdemeanor","Discretionary","Indefinite"
"Iowa Code § 533C.204","https://www.legis.iowa.gov/law/iowaCode/sections?codeChapter=533C&year=2018","Ineligible for money transmission license (conviction of director/officer/partner)","2","(1)(b)-(c)
(4)","","","2023 legislative session and all 2023 regulatory rulemaking","","Employment & volunteering|Business licensure & participation","Money services & check cashing","Any felony|Any misdemeanor|Crimes involving fraud, dishonesty, misrepresentation or money-laundering","Mandatory/Automatic","Varies"
"Iowa Code § 542.10","https://www.legis.iowa.gov/law/iowaCode/sections?codeChapter=542&year=2018","Deny/suspend/revoke certified public accountant license","2","(1)(e)-(f), 2-3","","","2023 legislative session and all 2023 regulatory rulemaking","","Employment & volunteering|Business licensure & participation|Occupational & professional licensure & certification","Accounting","Any felony|Crimes involving fraud, dishonesty, misrepresentation or money-laundering","Discretionary","Varies"
"Iowa Code § 551A.3","https://www.legis.iowa.gov/law/iowaCode/sections?codeChapter=551A&year=2018","Disclose conviction of seller/officer/director/agent to potential  buyers of business opportunity","1","(6)(a)","Other triggering offenses: Securities offense details","","2023 legislative session and all 2023 regulatory rulemaking","","Business licensure & participation|Registration, publication & notification","Business contracts (private) & dissolution","Any felony|Other|Crimes involving fraud, dishonesty, misrepresentation or money-laundering","Mandatory/Automatic","Indefinite"
"Iowa Code § 600.8","https://www.legis.iowa.gov/law/iowaCode/sections?codeChapter=600&year=2018","Deny adoption petition","2","(1)(a)(3)
(1)(c)(1)-(6)
(2)(b)
5-7, 11,
(12)","","","2023 legislative session and all 2023 regulatory rulemaking","","Family & domestic rights","Adoption & foster care","Any felony|Controlled substances offenses|Crimes of violence, including 'person offenses'|Sex offenses","Mandatory/Automatic","Varies"
"Iowa Code § 600A.8","https://www.legis.iowa.gov/law/iowaCode/sections?codeChapter=600A&year=2018","Terminate parental rights upon hearing","1","(9)-(10)","","","2023 legislative session and all 2023 regulatory rulemaking","","Family & domestic rights","Child custody, visitation & parental rights","Any felony|Any misdemeanor|Crimes of violence, including 'person offenses'|Sex offenses","Discretionary","Indefinite"
"Iowa Code § 600C.1","https://www.legis.iowa.gov/law/iowaCode/sections?codeChapter=600C&year=2018","Deny visitation rights for grandparents","1","4(h)","","","2023 legislative session and all 2023 regulatory rulemaking","","Family & domestic rights","Child custody, visitation & parental rights","Any felony|Any misdemeanor|Crimes of violence, including 'person offenses'|Sex offenses","Discretionary","Indefinite"
"Iowa Code § 692A.113","https://www.legis.iowa.gov/law/iowaCode/sections?codeChapter=692A&year=2018","Ineligible for access to school/public library/child care facility/place intended for the primary use of minors","1","(1)(a)-(h)","","","2023 legislative session and all 2023 regulatory rulemaking","","Political & civic participation","Child care providers & youth programs|Education & schools|Sex offender registration, residency & proximity","Crimes of violence, including 'person offenses'|Sex offenses","Mandatory/Automatic","Indefinite"
"Iowa Code § 692A.113","https://www.legis.iowa.gov/law/iowaCode/sections?codeChapter=692A&year=2018","Ineligible for employment at place intended primarily for use by minors","1","(3)(a)-(d)","","","2023 legislative session and all 2023 regulatory rulemaking","","Employment & volunteering","Child care providers & youth programs|Education & schools|Sex offender registration, residency & proximity","Crimes of violence, including 'person offenses'|Sex offenses","Mandatory/Automatic","Indefinite"
"Iowa Code § 722.1","https://www.legis.iowa.gov/law/iowaCode/sections?codeChapter=722&year=2018","Remove/ineligible to serve as elected/appointed public officer/employee/juror (permanent for offering bribe)","1","All","","","2023 legislative session and all 2023 regulatory rulemaking","","Political & civic participation|Employment & volunteering","Public employment|Public office|Jury service","Public corruption offenses","Mandatory/Automatic","Indefinite"
"Iowa Code § 722.2","https://www.legis.iowa.gov/law/iowaCode/sections?codeChapter=722&year=2018","Remove/ineligible to serve as elected/appointed public officer/employee/juror (permanent for accepting bribe)","1","All","","","2023 legislative session and all 2023 regulatory rulemaking","","Political & civic participation|Employment & volunteering","Public employment|Public office|Jury service","Public corruption offenses","Mandatory/Automatic","Indefinite"
"Iowa Code § 80B.11D","https://www.legis.iowa.gov/law/iowaCode/sections?codeChapter=80B&year=2018","Ineligible to attend short course law enforcement academy","1","(1)-(2)","","","2023 legislative session and all 2023 regulatory rulemaking","","Employment & volunteering|Occupational & professional licensure & certification","Law enforcement, corrections & public safety|Education & schools","Any felony|Any misdemeanor","Discretionary","Indefinite"
"Iowa Code § 80B.11E","https://www.legis.iowa.gov/law/iowaCode/sections?codeChapter=80B&year=2018","Ineligible to attend law enforcement academy","1","(1)-(2)","","","2023 legislative session and all 2023 regulatory rulemaking","","Employment & volunteering|Occupational & professional licensure & certification","Law enforcement, corrections & public safety|Education & schools","Any felony|Any misdemeanor","Discretionary","Indefinite"
"Iowa Code § 88.14","https://www.legis.iowa.gov/law/iowaCode/sections?codeChapter=88&year=2018","Remove from office/employment (disclosure of trade secrets obtained from a safety/health inspection)","1","5-8, 11","See also:
Iowa Code § 88.12","","2023 legislative session and all 2023 regulatory rulemaking","","Political & civic participation|Employment & volunteering","Public employment|Public office","Crimes involving fraud, dishonesty, misrepresentation or money-laundering|Public corruption offenses","Mandatory/Automatic","Indefinite"
"Iowa Code § 99G.10","https://www.legis.iowa.gov/law/iowaCode/sections?codeChapter=99G&year=2018","Ineligible for employment with Iowa lottery authority","1","(8)-(9)","Other triggering offenses:
Gambling offenses","","2023 legislative session and all 2023 regulatory rulemaking","","Employment & volunteering","Gaming, lottery & racing","Any felony|Other|Crimes involving fraud, dishonesty, misrepresentation or money-laundering|Crime of moral turpitude","Mandatory/Automatic","Indefinite"
"Iowa Code § 9A.106","https://www.legis.iowa.gov/law/iowaCode/sections?codeChapter=9A&year=2018","Deny athlete agent registration","1","2(a)","Conviction self-disclosure requirement:
Iowa Code § 9A.105","","2023 legislative session and all 2023 regulatory rulemaking","","Employment & volunteering|Occupational & professional licensure & certification","Entertainment, athletics, news & broadcasting","Any felony|Crimes involving fraud, dishonesty, misrepresentation or money-laundering|Crime of moral turpitude","Discretionary","Indefinite"
"Iowa Code § 272C.15","","Ineligible for Educational License","1","All","","","2023 legislative session and all 2023 regulatory rulemaking","","","","Any felony","","Indefinite"
"Iowa Code § 147D.1","","Background Check for emergency medical services personnel","1","3(c)(4)","","","2023 legislative session and all 2023 regulatory rulemaking","","","","Any felony","",""
"Iowa Code § 152.5A","","Background Check  for Nursing School Applicants","1","All","","","2023 legislative session and all 2023 regulatory rulemaking","","","","Crimes of violence, including 'person offenses'|N/A (background check, general relief)","",""
"Iowa Code § 124E.9","","Background Check Medical Cannabidiol Dispensary ownership or employment","1","7, 8","","","2023 legislative session and all 2023 regulatory rulemaking","","","","","Mandatory/Automatic",""
"Iowa Code § 80B.11F","","Background check required for Law Enforcement Officers","1","1, 3(b), 4(b)","","","2023 legislative session and all 2023 regulatory rulemaking","","Occupational & professional licensure & certification","","","Mandatory/Automatic",""
"191 IAC 50.37","https://www.legis.iowa.gov/law/administrativeRules/rules?agency=191&chapter=50","Ineligible to solicit on behalf of an investment adviser","2","Delete Item (3)d), Item 4","Other triggering offenses:
Securities/banking/finance offenses

See also:
Iowa Code § 502.412
Iowa Code § 502.505","","2023 legislative session and all 2023 regulatory rulemaking","","Employment & volunteering","Banking, lending, securities & finance|Insurance sales & services","Any felony|Any misdemeanor|Other|Crimes involving fraud, dishonesty, misrepresentation or money-laundering","Mandatory/Automatic","Varies"
"282 IAC 23.1","https://www.legis.iowa.gov/law/administrativeRules/rules?agency=282&chapter=23","Ineligible for behind-the-wheel driving instructor authorization","1","(1)(b)","Could Not Find Statute -
282 IAC 11.42","","2023 legislative session and all 2023 regulatory rulemaking","","Employment & volunteering|Occupational & professional licensure & certification","Driving & noncommercial motor vehicles|Education & schools|Teachers & instructors","Controlled substances offenses|Motor vehicle offenses","Mandatory/Automatic","Time-limited"
"441 IAC 112.6","https://www.legis.iowa.gov/law/administrativeRules/rules?agency=441&chapter=112","Revoke foster care facility license (conviction of owner/director/parent/staff/resident)","1","(1)(c)","","","2023 legislative session and all 2023 regulatory rulemaking","","Family & domestic rights|Employment & volunteering|Business licensure & participation|Housing & residency","Adoption & foster care","Any felony|Any misdemeanor","Discretionary (waiver)","Indefinite"
"441 IAC 119.2","https://www.legis.iowa.gov/law/administrativeRules/rules?agency=441&chapter=119","Ineligible for employment/enrollment as a student in health care training program","1","All","","","2023 legislative session and all 2023 regulatory rulemaking","","Education|Employment & volunteering","Health care|Education & schools|Students & interns","Any felony|Any misdemeanor","Discretionary (waiver)","Indefinite"
"481 IAC 51.41","https://www.legis.iowa.gov/law/administrativeRules/rules?agency=481&chapter=51","Ineligible for temporary employment in a hospital pending evaluation","1","All","","","2023 legislative session and all 2023 regulatory rulemaking","","Employment & volunteering|Occupational & professional licensure & certification","Health care","Any felony|Any misdemeanor|Controlled substances offenses|Motor vehicle offenses","Mandatory/Automatic","Indefinite"
"489 IAC 4.2","https://www.legis.iowa.gov/law/administrativeRules/rules?agency=489&chapter=4","Ineligible for to serve as court appointed special advocate (CASA) coach","2","(4)(f)-(g)","","","2023 legislative session and all 2023 regulatory rulemaking","","Political & civic participation|Employment & volunteering","Lawyers, judges & advocates","Any felony|Any misdemeanor|Crimes of violence, including 'person offenses'|Sex offenses","Varies","Indefinite"
"641 IAC 22.17","https://www.legis.iowa.gov/law/administrativeRules/rules?agency=641&chapter=22","Deny/suspend/revoke tattoo permit (applicants/licensees)","1","(1)(u)","","","2023 legislative session and all 2023 regulatory rulemaking","","Employment & volunteering|Occupational & professional licensure & certification","Cosmetology, barbering, electrology, tattooing & body art","Controlled substances offenses|Crimes of violence, including 'person offenses'|Crimes involving fraud, dishonesty, misrepresentation or money-laundering|Sex offenses","Discretionary","Indefinite"
"645 IAC 224.2","https://www.legis.iowa.gov/law/administrativeRules/rules?agency=645&chapter=224","Suspend/revoke podiatrist license","1","(12)-(13), (16)","Other triggering offenses:
Violations of laws relating to the practice of the profession 

See also:
645 IAC 224.3","","2023 legislative session and all 2023 regulatory rulemaking","","Employment & volunteering|Occupational & professional licensure & certification","Health care|Podiatry","Any felony|Any misdemeanor|Other","Discretionary","Indefinite"
"645 IAC 329.2","https://www.legis.iowa.gov/law/administrativeRules/rules?agency=645&chapter=329","Suspend/revoke physician assistant license","1","(11)-(12), (15)","Other triggering offenses:
Violations of laws relating to the practice of the profession 

See also:
645 IAC 329.3","","2023 legislative session and all 2023 regulatory rulemaking","","Employment & volunteering|Occupational & professional licensure & certification","Health care|Physician assistants","Any felony|Any misdemeanor|Other","Discretionary","Indefinite"
"645 IAC 83.2","https://www.legis.iowa.gov/law/administrativeRules/rules?agency=645&chapter=83","Deny/suspend/revoke dietician license","1","(12)-(13), (16)","Other triggering offenses:
Violations of laws relating to the practice of dieticians 

See also:
645 IAC 83.3","","2023 legislative session and all 2023 regulatory rulemaking","","Employment & volunteering|Occupational & professional licensure & certification","Health care|Dieticians & nutritionists","Any felony|Any misdemeanor|Other","Discretionary","Indefinite"
"761 IAC 607.30","https://www.legis.iowa.gov/law/administrativeRules/rules?agency=761&chapter=607","Deny third-party skills test examiner certification","2","(3)(a)","","","2023 legislative session and all 2023 regulatory rulemaking","","Employment & volunteering|Occupational & professional licensure & certification","Transportation & commercial motor vehicles|Driving & noncommercial motor vehicles|Education & schools","Any felony|Crimes involving fraud, dishonesty, misrepresentation or money-laundering","Mandatory/Automatic","Varies"
"761 IAC 634.6","https://www.legis.iowa.gov/law/administrativeRules/rules?agency=761&chapter=634","Ineligible to be a driver education teacher","1","(1)
(2)(a)-(b)","","","2023 legislative session and all 2023 regulatory rulemaking","","Employment & volunteering|Occupational & professional licensure & certification","Driving & noncommercial motor vehicles|Education & schools|Teachers & instructors","Controlled substances offenses|Motor vehicle offenses","Mandatory/Automatic","Time-limited"
"761 IAC 636.8","https://www.legis.iowa.gov/law/administrativeRules/rules?agency=761&chapter=636","Ineligible for motorcycle rider teacher's license","1","(1)-(4)","","","2023 legislative session and all 2023 regulatory rulemaking","","Employment & volunteering|Occupational & professional licensure & certification","Driving & noncommercial motor vehicles|Education & schools|Teachers & instructors","Controlled substances offenses|Motor vehicle offenses","Mandatory/Automatic","Time-limited"
"817 IAC 8.4","https://www.legis.iowa.gov/law/administrativeRules/rules?agency=817&chapter=8","Background check for Iowa youth mentoring certification","1","(4)((c); (11)(d)","","","2023 legislative session and all 2023 regulatory rulemaking","","Government contracting & program participation|Business licensure & participation|Occupational & professional licensure & certification","Child care providers & youth programs|Education & schools|Teachers & instructors","N/A (background check, general relief)","Background Check","N/A (background check, general relief)"
