Citation,Citation URL,Title,Number of Consequences,Relevant Subsections,Related Statutes,Notes,Current Through,Jurisdiction,Consequences,Keywords,Offense Type,Discretion,Duration
"191 IAC 50.62","https://www.legis.iowa.gov/law/administrativeRules/rules?agency=191&chapter=50","Ineligible for streamlined registration for equity security (conviction of issuer/officer/shareholder/broker-dealer)","2","(2)(b)(1),(2)","Other triggering offenses:
Securities-relates felony offenses","","2023 legislative session and all 2023 regulatory rulemaking","","Employment & volunteering","Banking, lending, securities & finance","Other|Crimes involving fraud, dishonesty, misrepresentation or money-laundering","Discretionary (waiver)","Varies"
"191 IAC 55.12","https://www.legis.iowa.gov/law/administrativeRules/rules?agency=191&chapter=55","Deny/suspend/revoke public adjuster license","1","(1)(g)","Relief:
191 IAC 55.13","","2023 legislative session and all 2023 regulatory rulemaking","","Employment & volunteering|Occupational & professional licensure & certification","Insurance sales & services","Any felony","Discretionary","Indefinite"
"193 IAC 14.3","https://www.legis.iowa.gov/law/administrativeRules/rules?agency=193&chapter=14","Background check for professional license via veteran reciprocity","1","(2), (5)","","","2023 legislative session and all 2023 regulatory rulemaking","","Employment & volunteering|Occupational & professional licensure & certification","Military, veterans & national defense","N/A (background check, general relief)","Background Check","N/A (background check, general relief)"
"193A IAC 3.4","https://www.legis.iowa.gov/law/administrativeRules/rules?agency=193A&chapter=3","Deny admittance to certified public accountant's examination","1","3.4(3)","","","2023 legislative session and all 2023 regulatory rulemaking","","Employment & volunteering|Occupational & professional licensure & certification","Accounting","Crimes involving fraud, dishonesty, misrepresentation or money-laundering","Discretionary","Indefinite"
"193A IAC 8.1","https://www.legis.iowa.gov/law/administrativeRules/rules?agency=193A&chapter=8","Deny initial accounting firm registration (conviction of owners)","1","(1),(7), (10), (12)(a)","Conviction self-disclosure requirement:
193A IAC 7.3

See also:
Iowa Code § 542.5","","2023 legislative session and all 2023 regulatory rulemaking","","Business licensure & participation","Accounting","Any felony|Crimes involving fraud, dishonesty, misrepresentation or money-laundering","Discretionary","Indefinite"
"193A IAC 9.3","https://www.legis.iowa.gov/law/administrativeRules/rules?agency=193A&chapter=9","Deny substantial equivalency CPA certificate for individuals licensed in another state","1","(1)(d)_x000D_
(2)","Additional offense details:_x000D_
193A IAC 3.1_x000D_
Iowa Code § 542.5","","2023 legislative session and all 2023 regulatory rulemaking","","Employment & volunteering|Occupational & professional licensure & certification","Accounting","Crimes involving fraud, dishonesty, misrepresentation or money-laundering","Discretionary","Indefinite"
"193E IAC 3.1","https://www.legis.iowa.gov/law/administrativeRules/rules?agency=193E&chapter=3","Deny real estate broker's license","1","3","","","2023 legislative session and all 2023 regulatory rulemaking","","Occupational & professional licensure & certification","Real estate & property","Crimes involving fraud, dishonesty, misrepresentation or money-laundering|Crime of moral turpitude","Discretionary","Indefinite"
"193E IAC 4.1","https://www.legis.iowa.gov/law/administrativeRules/rules?agency=193E&chapter=4","Deny real estate salesperson license","1","7, 8","","","2023 legislative session and all 2023 regulatory rulemaking","","Occupational & professional licensure & certification","Real estate & property","Crimes involving fraud, dishonesty, misrepresentation or money-laundering|Crime of moral turpitude","Discretionary","Indefinite"
"193G IAC 5.2","https://www.legis.iowa.gov/law/administrativeRules/rules?agency=193G&chapter=5","Suspend/revoke interior designer registration","1","1,2,6","Additional offense details:
Iowa Code section 544C.9 
Iowa Code section 272C.10
93G IAC 7.3

Relief:
193G IAC 7.5","","2023 legislative session and all 2023 regulatory rulemaking","","Employment & volunteering|Occupational & professional licensure & certification","Construction, improvement & repair, engineering, plumbing, HVAC, surveying, design & architecture","Any felony","Discretionary","Indefinite"
"201 IAC 20.3","https://www.legis.iowa.gov/law/administrativeRules/rules?agency=201&chapter=20","Ineligible to visit incarcerated individual","1","Add subsection (1)","Background check:
201 IAC 20.2 -DELETE

Other triggering offenses:
Escape
Introducing contraband to a prison","","2023 legislative session and all 2023 regulatory rulemaking","","Family & domestic rights|Political & civic participation","","Any felony|Other","Mandatory/Automatic","Indefinite"
"201 IAC 38.2","https://www.legis.iowa.gov/law/administrativeRules/rules?agency=201&chapter=38","Notify sex offense victim of offender's placement on electronic monitoring system","1","(4)(a)-(b)","","","2023 legislative session and all 2023 regulatory rulemaking","","Registration, publication & notification","Sex offender registration, residency & proximity","Crimes of violence, including 'person offenses'|Sex offenses","Mandatory/Automatic","Indefinite"
"201 IAC 40.5","https://www.legis.iowa.gov/law/administrativeRules/rules?agency=201&chapter=40","Background check for employment in community-based corrections","1","10","","","2023 legislative session and all 2023 regulatory rulemaking","","Employment & volunteering","Law enforcement, corrections & public safety|Public employment","N/A (background check, general relief)","N/A - General Relief","N/A (background check, general relief)"
"201 IAC 50.24","https://www.legis.iowa.gov/law/administrativeRules/rules?agency=201&chapter=50","Background check for employment supervising juveniles in nonsecure hold facility","1","(2)(e)","","","2023 legislative session and all 2023 regulatory rulemaking","","Employment & volunteering","Law enforcement, corrections & public safety|Public employment","N/A (background check, general relief)","Background Check","N/A (background check, general relief)"
"201 IAC 51.20","https://www.legis.iowa.gov/law/administrativeRules/rules?agency=201&chapter=51","Background check for employment supervising juveniles in nonsecure hold in temporary holding facilities","1","(2)(e)","","","2023 legislative session and all 2023 regulatory rulemaking","","Employment & volunteering","Law enforcement, corrections & public safety|Public employment","N/A (background check, general relief)","Background Check","N/A (background check, general relief)"
"201 IAC 6.1","https://www.legis.iowa.gov/law/administrativeRules/rules?agency=201&chapter=6","Background check for employment with department of corrections","1","(2)-(3), (7)","","","2023 legislative session and all 2023 regulatory rulemaking","","Employment & volunteering","Law enforcement, corrections & public safety|Public employment","N/A (background check, general relief)","N/A - General Relief","N/A (background check, general relief)"
"282 IAC 18.1","https://www.legis.iowa.gov/law/administrativeRules/rules?agency=282&chapter=18","Background check for Iowa administrator license (temporary permits)","1","2, 3","DELETE - See also:
282 IAC 11.34","","2023 legislative session and all 2023 regulatory rulemaking","","Employment & volunteering|Occupational & professional licensure & certification","Education & schools","N/A (background check, general relief)","Background Check","N/A (background check, general relief)"
"282 IAC 22.1","https://www.legis.iowa.gov/law/administrativeRules/rules?agency=282&chapter=22","Background check for coaching authorization","1","2(c), (7)(b)(7)","See also:
282 IAC 11.35","","2023 legislative session and all 2023 regulatory rulemaking","","Occupational & professional licensure & certification","Education & schools|Teachers & instructors","N/A (background check, general relief)","N/A - General Relief","N/A (background check, general relief)"
"282 IAC 22.10","https://www.legis.iowa.gov/law/administrativeRules/rules?agency=282&chapter=22","Background check for school activities administration authorization","1","(1)(e), (2)(a)-(b)","See also:
282 IAC 11.36","","2023 legislative session and all 2023 regulatory rulemaking","","Employment & volunteering|Occupational & professional licensure & certification","Education & schools","N/A (background check, general relief)","Background Check","N/A (background check, general relief)"
"282 IAC 22.7","https://www.legis.iowa.gov/law/administrativeRules/rules?agency=282&chapter=22","Background check for school administration manager authorization","1","
(4)(c)","DELETE - Staute No longer exists - 
282 IAC 11.40","","2023 legislative session and all 2023 regulatory rulemaking","","Employment & volunteering|Occupational & professional licensure & certification","Education & schools","N/A (background check, general relief)","Background Check","N/A (background check, general relief)"
"433 IAC 2.13","https://www.legis.iowa.gov/law/administrativeRules/rules?agency=433&chapter=2","Ineligible to serve as a qualified general/specialized interpreter","1","1","","","2023 legislative session and all 2023 regulatory rulemaking","","Employment & volunteering|Occupational & professional licensure & certification","Interpreters","Any felony","Mandatory/Automatic","Indefinite"
"441 IAC 105.19","https://www.legis.iowa.gov/law/administrativeRules/rules?agency=441&chapter=105","Ineligible/revoke juvenile detention/shelter care facility certification (conviction of director)","1","(2)(c)
(6)(a)(4)","","","2023 legislative session and all 2023 regulatory rulemaking","","Employment & volunteering","Law enforcement, corrections & public safety","Any felony|Any misdemeanor","Mandatory/Automatic","Indefinite"
"441 IAC 105.19","https://www.legis.iowa.gov/law/administrativeRules/rules?agency=441&chapter=105","Revoke juvenile detention facility/shelter care home certification (conviction of employee)","1","(6)(b)(2)","","","2023 legislative session and all 2023 regulatory rulemaking","","Employment & volunteering","Law enforcement, corrections & public safety","Any felony|Any misdemeanor","Discretionary","Indefinite"
"441 IAC 107.8","https://www.legis.iowa.gov/law/administrativeRules/rules?agency=441&chapter=107","Ineligible for adoption approval","2","(1)(c), (1)(d), (1)(f)-(h)(2); (2)","See also:
Iowa Code § 600.8
441 IAC 108.9","","2023 legislative session and all 2023 regulatory rulemaking","","Family & domestic rights","Adoption & foster care","Any felony|Any misdemeanor","Varies","Indefinite"
"441 IAC 109.10","https://www.legis.iowa.gov/law/administrativeRules/rules?agency=441&chapter=109","Ineligible to own/work/volunteer at child care center","1","(16)(a)-(b)
(16)(d)","","","2023 legislative session and all 2023 regulatory rulemaking","","Employment & volunteering","Child care providers & youth programs","Crimes of violence, including 'person offenses'|Sex offenses","Mandatory/Automatic","Indefinite"
"441 IAC 109.6","https://www.legis.iowa.gov/law/administrativeRules/rules?agency=441&chapter=109","Background check to reside at child care center home","1","109.6(6)(a)(1)","0","","2023 legislative session and all 2023 regulatory rulemaking","","Family & domestic rights|Housing & residency","Child care providers & youth programs","N/A (background check, general relief)","Background Check","N/A (background check, general relief)"
"441 IAC 110.16","https://www.legis.iowa.gov/law/administrativeRules/rules?agency=441&chapter=110","Deny/revoke child development home registration (child support offenses)","1","All","Additional offense details:
Iowa Code § 726.5","","2023 legislative session and all 2023 regulatory rulemaking","","Business licensure & participation|Occupational & professional licensure & certification","Child care providers & youth programs","Child Support offenses","Mandatory/Automatic","Indefinite"
"441 IAC 114.8","https://www.legis.iowa.gov/law/administrativeRules/rules?agency=441&chapter=114","Ineligible for employment with group living foster care facility (discretionary waiver)","1","(1)(e)","","","2023 legislative session and all 2023 regulatory rulemaking","","Employment & volunteering","Adoption & foster care","Any felony|Any misdemeanor","Discretionary (waiver)","Indefinite"
"441 IAC 162.3","https://www.legis.iowa.gov/law/administrativeRules/rules?agency=441&chapter=162","Background check to receive long-term care service facility development grant","1","(1)(a)-(b)
(3)(d)(3)","Additional offense details:
441 IAC 120.2","","2023 legislative session and all 2023 regulatory rulemaking","","Government loans & grants","Health care|Adult care, nursing homes & residential care facilities","N/A (background check, general relief)","Background Check","N/A (background check, general relief)"
"441 IAC 200.11","https://www.legis.iowa.gov/law/administrativeRules/rules?agency=441&chapter=200","Deny approval of adoptive home study","1","2","","","2023 legislative session and all 2023 regulatory rulemaking","","Family & domestic rights","Adoption & foster care","Any felony|Any misdemeanor","Discretionary (waiver)","Indefinite"
"441 IAC 200.4","https://www.legis.iowa.gov/law/administrativeRules/rules?agency=441&chapter=200","Ineligible to adopt","2","(1)(b)-(c), (1)(e)(1), (1)(g)(2)","See also:
441 IAC 113.13","","2023 legislative session and all 2023 regulatory rulemaking","","Family & domestic rights","Adoption & foster care","Any felony|Any misdemeanor","Varies","Indefinite"
"441 IAC 25.102","https://www.legis.iowa.gov/law/administrativeRules/rules?agency=441&chapter=25","Background check for appointment as mental health advocate","1","(2)(c)","Background check: 
441 IAC 25.105","","2023 legislative session and all 2023 regulatory rulemaking","","Employment & volunteering","Health care|Psychiatry, psychology, counseling & mental health services","N/A (background check, general relief)","Background Check","N/A (background check, general relief)"
"441 IAC 31.2","https://www.legis.iowa.gov/law/administrativeRules/rules?agency=441&chapter=31","Deny approval to visit a civilly committed individual","1","(1)(a)(2)
(7)(a)","","","2023 legislative session and all 2023 regulatory rulemaking","","Family & domestic rights","Civil commitment","Any felony|Any misdemeanor","Discretionary","Indefinite"
"441 IAC 41.25","https://www.legis.iowa.gov/law/administrativeRules/rules?agency=441&chapter=41","Ineligible for family investment program assistance","1","10","","","2023 legislative session and all 2023 regulatory rulemaking","","Government benefits","Public assistance & food stamps","Any felony|Any misdemeanor","Mandatory/Automatic","Time-limited"
"441 IAC 46.29","https://www.legis.iowa.gov/law/administrativeRules/rules?agency=441&chapter=46","Ineligible to receive public assistance","1","All","","","2023 legislative session and all 2023 regulatory rulemaking","","Government benefits|Housing & residency","Public assistance & food stamps","Crimes involving fraud, dishonesty, misrepresentation or money-laundering","Mandatory/Automatic","Time-limited"
"441 IAC 65.46","https://www.legis.iowa.gov/law/administrativeRules/rules?agency=441&chapter=65","Ineligible to participate in food assistance program","1","(2), (4)","","","2023 legislative session and all 2023 regulatory rulemaking","","Government benefits","Public assistance & food stamps","Weapons offenses|Crimes involving fraud, dishonesty, misrepresentation or money-laundering","Mandatory/Automatic","Indefinite"
"441 IAC 77.30","https://www.legis.iowa.gov/law/administrativeRules/rules?agency=441&chapter=77","Background check for employment as  independent support broker","1","(14)(e)","","","2023 legislative session and all 2023 regulatory rulemaking","","Employment & volunteering","Health care|Medicaid, Medicare & other public health benefits","N/A (background check, general relief)","Background Check","N/A (background check, general relief)"
"481 IAC 105.7","https://www.legis.iowa.gov/law/administrativeRules/rules?agency=481&chapter=105","Deny/revoke amusement device registration","1","(1), (4), (5)","Other triggering offenses:
Gambling offenses","","2023 legislative session and all 2023 regulatory rulemaking","","Business licensure & participation","Gaming, lottery & racing|Entertainment, athletics, news & broadcasting","Other","Discretionary","Indefinite"
"531 IAC 14.4","https://www.legis.iowa.gov/law/administrativeRules/rules?agency=531&chapter=14","Background check for monitor vending machine lottery retailer license","1","5","","","2023 legislative session and all 2023 regulatory rulemaking","","Employment & volunteering|Business licensure & participation","Gaming, lottery & racing","N/A (background check, general relief)","Background Check","N/A (background check, general relief)"
"531 IAC 14.5","https://www.legis.iowa.gov/law/administrativeRules/rules?agency=531&chapter=14","Background check for monitor vending machine lottery premises license","1","1","","","2023 legislative session and all 2023 regulatory rulemaking","","Employment & volunteering|Business licensure & participation","Gaming, lottery & racing","N/A (background check, general relief)","Background Check","N/A (background check, general relief)"
"531 IAC 2.16","https://www.legis.iowa.gov/law/administrativeRules/rules?agency=531&chapter=2","Ineligible to bid on lottery procurement contract (bidder/employee felony conviction related to lottery integrity/security)","1","(1)(e)
(2)(a), (2)(b)(8)-(10), (3)(a), (3)(b)(18), (4)","","","2023 legislative session and all 2023 regulatory rulemaking","","Government contracting & program participation|Employment & volunteering","Gaming, lottery & racing","Crimes involving fraud, dishonesty, misrepresentation or money-laundering","Mandatory/Automatic","Indefinite"
"571 IAC 12.23","https://www.legis.iowa.gov/law/administrativeRules/rules?agency=571&chapter=12","Ineligible for volunteer instructor certification for recreational licenses","2","3","","","2023 legislative session and all 2023 regulatory rulemaking","","Recreational license & participation, including firearms|Occupational & professional licensure & certification","","Any felony|Any misdemeanor","Mandatory/Automatic","Varies"
"571 IAC 14.4","https://www.legis.iowa.gov/law/administrativeRules/rules?agency=571&chapter=14","Background check for employment as concessionaire in state park/recreation area","1","8","","","2023 legislative session and all 2023 regulatory rulemaking","","Employment & volunteering|Business licensure & participation","Agriculture, livestock & food","N/A (background check, general relief)","Background Check","N/A (background check, general relief)"
"571 IAC 15.16","https://www.legis.iowa.gov/law/administrativeRules/rules?agency=571&chapter=15","Suspend/revoke hunting/fishing/trapping privileges","2","(1), (3)-(9)","","","2023 legislative session and all 2023 regulatory rulemaking","","Recreational license & participation, including firearms","Wildlife, fish & game","Child Support offenses|Recreational license offenses","Mandatory/Automatic","Time-limited"
"591 IAC 11.5","https://www.legis.iowa.gov/law/administrativeRules/rules?agency=591&chapter=11","Ineligible to receive payments/reimbursements with petroleum underground storage tank program funds","1","(3)-(5)","","","2023 legislative session and all 2023 regulatory rulemaking","","Government contracting & program participation|Business licensure & participation","Hazardous materials, pesticides, chemicals & waste","Crimes involving fraud, dishonesty, misrepresentation or money-laundering","Discretionary (waiver)","Time-limited"
"641 IAC 133.4","https://www.legis.iowa.gov/law/administrativeRules/rules?agency=641&chapter=133","Deny white flashing light authorization certificate","1","(1)(b)","","","2023 legislative session and all 2023 regulatory rulemaking","","Motor vehicle licensure (non-commercial)|Occupational & professional licensure & certification","Driving & noncommercial motor vehicles","Motor vehicle offenses","Discretionary","Indefinite"
"641 IAC 32.2","https://www.legis.iowa.gov/law/administrativeRules/rules?agency=641&chapter=32","Suspend/revoke plumbing/mechanical systems license","1","(5), (18), (21)","See also:
641 IAC 32.3","","2023 legislative session and all 2023 regulatory rulemaking","","Employment & volunteering|Occupational & professional licensure & certification","Construction, improvement & repair, engineering, plumbing, HVAC, surveying, design & architecture","Any felony","Discretionary","Indefinite"
"661 IAC 8.104","https://www.legis.iowa.gov/law/administrativeRules/rules?agency=661&chapter=8","Ineligible for authorization to access to IOWA online criminal justice information system","1","(3)(c)(d)","","","2023 legislative session and all 2023 regulatory rulemaking","","Employment & volunteering","Sensitive information access","Any felony|Any misdemeanor","Discretionary","Indefinite"
"661 IAC 83.4","https://www.legis.iowa.gov/law/administrativeRules/rules?agency=661&chapter=83","Publish sex offender registry information on internet","1","All","Additional offense details:
Iowa Code § 709.4","","2023 legislative session and all 2023 regulatory rulemaking","","Registration, publication & notification","Sex offender registration, residency & proximity","Crimes of violence, including 'person offenses'|Sex offenses","Mandatory/Automatic","Indefinite"
"661 IAC 83.5","https://www.legis.iowa.gov/law/administrativeRules/rules?agency=661&chapter=83","Expunge registration from sex offender registry","0","(1)-(2)","Additional offense details:
661 IAC 83.2","","2023 legislative session and all 2023 regulatory rulemaking","","General Relief Provision","Expungement, sealing & criminal record access restrictions|Sex offender registration, residency & proximity","N/A (background check, general relief)","N/A - General Relief","N/A (background check, general relief)"
"661 IAC 91.3","https://www.legis.iowa.gov/law/administrativeRules/rules?agency=661&chapter=91","Ineligible for a permit to carry firearms","2","(1)(a)-(b), (1)(i), (2)(a), (3)(d), (3)(f)-(g)","Background check:
661 IAC 91.5","","2023 legislative session and all 2023 regulatory rulemaking","","Recreational license & participation, including firearms","Firearms, weapons & explosives","Any felony|Crimes of violence, including 'person offenses'","Mandatory/Automatic","Varies"
"661 IAC 91.6","https://www.legis.iowa.gov/law/administrativeRules/rules?agency=661&chapter=91","Revoke permit to carry firearms","1","(1)-(4)","See also:
661 IAC 91.3","","2023 legislative session and all 2023 regulatory rulemaking","","Recreational license & participation, including firearms","Firearms, weapons & explosives","Any felony|Crimes of violence, including 'person offenses'","Mandatory/Automatic","Indefinite"
"761 IAC 615.16","https://www.legis.iowa.gov/law/administrativeRules/rules?agency=761&chapter=615","Suspend driver's license (out-of-state conviction for a suspendable offense)","1","All","","","2023 legislative session and all 2023 regulatory rulemaking","","Motor vehicle licensure (non-commercial)","Driving & noncommercial motor vehicles","Controlled substances offenses|Motor vehicle offenses","Discretionary","Indefinite"
"761 IAC 615.30","https://www.legis.iowa.gov/law/administrativeRules/rules?agency=761&chapter=615","Revoke driver's license (out-of-state conviction for a revocable offense)","1","All","","","2023 legislative session and all 2023 regulatory rulemaking","","Motor vehicle licensure (non-commercial)","Driving & noncommercial motor vehicles","Controlled substances offenses|Motor vehicle offenses","Discretionary","Indefinite"
"761 IAC 615.9","https://www.legis.iowa.gov/law/administrativeRules/rules?agency=761&chapter=615","Revoke driving privilege (accumulation of points/habitual violator)","1","(1)(a)-(b)
(2)-(3)","Other triggering offenses:
Use of a motor vehicle in the commission of a felony 

See also:
Iowa Code § 321.555","","2023 legislative session and all 2023 regulatory rulemaking","","Motor vehicle licensure (non-commercial)","Driving & noncommercial motor vehicles","Motor vehicle offenses|Other","Mandatory/Automatic","Time-limited"
"761 IAC 911.6","https://www.legis.iowa.gov/law/administrativeRules/rules?agency=761&chapter=911","Background check for employment with school transportation service","1","(3)-(4)","","","2023 legislative session and all 2023 regulatory rulemaking","","Employment & volunteering","Transportation & commercial motor vehicles|Education & schools","N/A (background check, general relief)","Background Check","N/A (background check, general relief)"
"811 IAC 10.6","https://www.legis.iowa.gov/law/administrativeRules/rules?agency=811&chapter=10","Suspend/revoke veterinary credentials","1","(6), (10), (22)(3)","","","2023 legislative session and all 2023 regulatory rulemaking","","Employment & volunteering|Occupational & professional licensure & certification","Veterinarians","Any felony","Discretionary","Indefinite"
"811 IAC 8.6","https://www.legis.iowa.gov/law/administrativeRules/rules?agency=811&chapter=8","Suspend/revoke veterinary technician certificate","1","(2), (6)","Other triggering offenses:
Cruelty to animals","","2023 legislative session and all 2023 regulatory rulemaking","","Occupational & professional licensure & certification","Veterinarians","Any felony|Other","Discretionary","Indefinite"
